web-scraper-order,web-scraper-start-url,profesoresurl,profesoresurl-href,review,nota
"1576101719-344","https://losestudiantes.co/","Pablo Lorenzana PomboMedicina General","https://losestudiantes.co/universidad-nacional/medicina/profesores/pablo-lorenzana-pombo","En pregrado se encuentran con el los afortunados que pueden ver Neurología, no sé si ya habrán cambiado el sistema pero no todos podían rotar en esta area. El contacto con el dr es escaso durante la rotación, explica de manera muy concreta y hace preguntas, pero como estudiante puedes pasar desapercibido, los internos y residentes tienen un poco más de atención. Podría esforzarse más por hacer que sus estudiantes se apasionen por su especialidad si se lo propusiera.Pros: es un duro en su especialidadCons: no comparte bien lo que sabe a los estudiantes de pregrado cursano neurologia en el semestre de medicina interna, no se esfuerza en inspirar a sus estudiantes, en contraste con la mayoría de los profesores de la  facultad de medicina de la nacional. Quizás si sea más académico y apasionado por su tema en su electiva pero ignoro del tema","3"
"1576101867-349","https://losestudiantes.co/","Janneth Suarez BrandComunicacion Humana y sus Desordenes Medicina","https://losestudiantes.co/universidad-nacional/comunicacion-humana-y-sus-desordenes-medicina/profesores/janneth-suarez-brand","Pros: Ella sabe varios conceptos, pero no sabe enseñar. Cons: No dicta la clase, es muy inestable anímicamente. Y los talleres propuestos nunca se culminan. No hay orden en el plan, nunca se sigue lo que dice el plan de la materia.","2"
"1576101860-347","https://losestudiantes.co/","Maria Victoría Valero BernalMedicina General","https://losestudiantes.co/universidad-nacional/medicina/profesores/maria-victoria-valero-bernal","La Dra Valero es una persona comprometida con la enseñanza, tiene muy buena energia y es muy recursiva. Siempre esta buscando la participacion de sus estudiantes. Valoro mucho su manera de tomar las notas porque uno se da cuenta que l9 de menos es eso, es decir se da cuenta que vale mas lo que uno aprende y como lo aplica en la vida real. Es un profesional muy bien preparada, conocedora de sus temas a cargo, ademas es muy amigable y muy cercana de los estudiantes. Tambien es exigente y valooñra la excelencia de sus estudiantes. Es una de las profesoras de las que mas he aprendidoPros: Aplicacion de los contenidos enseñados a situaciones realesCons: En ocasiones no es claro el curso de la progamacion. Se salta o adelanta temas.","4.9"
"1576101755-346","https://losestudiantes.co/","Sonia Isabel Cuervo MaldonadoMedicina General","https://losestudiantes.co/universidad-nacional/medicina/profesores/sonia-isabel-cuervo-maldonado","Es un excelente ser humano, con un conocimiento de la infectología profundo, una gran docente clínica y con un profundo amor por la semiología clásica, los nuevos métodos diagnósticos y los avances en microbiología e infectología.","5"
"1576101755-345","https://losestudiantes.co/","Sonia Isabel Cuervo MaldonadoMedicina General","https://losestudiantes.co/universidad-nacional/medicina/profesores/sonia-isabel-cuervo-maldonado","ES LA MEJOR PROFESORA, jaja bueno es una de las mejores con las que tuve la fortuna de rotar, especialista en infectología, la dra Cuervo es una de las pedagogas de la facultad, el y su esposo se esfuerzan por inspirar pasión por el aprendizaje, sencillamente aprendes mucho con ella en tan corto tiempo, se esfuerza por dejarte una huella y amor por su materia, es lo mejor que un profesor puede hacer. Sencillamente TODOS los profesores deberían seguir el ejemplo de esta pareja y actualizarse constantemente en metodos pedagógicos para así tener mejores médicos , con calidad humana y apasionados por el conocimiento y el aprendizajePros: te da nemotecnias , guias,tips, te enseña a amar la infectología. Cons: muy poco tiempo se rota con ella. Pero esto no es problema de ella sino del departamento.","5"
"1576101860-348","https://losestudiantes.co/","Maria Victoría Valero BernalMedicina General","https://losestudiantes.co/universidad-nacional/medicina/profesores/maria-victoria-valero-bernal","Es una profesora dedicada, se vio por parte de ella un interes en mediar los problemas encontrados en el desarrollo logistico de la materia, asi como la busqueda de conciliacion con los estudiantes que no estaban conformes con las soluciones propuestas, siempre estuvo disponible para hablar sobre los problemas de la materia. El desarrollo de la materia a cargo de la profesora fue normal.Pros: Abierta a resolver dudas y problemas con la materiaCons: Casi nunca estaba presente en clase, siempre toco buscarla extraclase","4"
"1576101884-350","https://losestudiantes.co/","Hugo Alberto Fajardo RodriguezMedicina General","https://losestudiantes.co/universidad-nacional/medicina/profesores/hugo-alberto-fajardo-rodriguez","Bienvenidos al mundo de la eterna revista, el dr se caracteriza por la lentitud de su revista, aunque a su favor es que explica bastante bien , sin embargo burlase  de la ignorancia de sus estudiantes a veces lo hace pasar por tosco, un profesor debe incentivar el amor por su materia, no permitir que ninguno de sus estudiantes sea depordebajeado por un residente, sobretodo cuando Medicina Interna es la materia de entrada al mundo clínico y los estudiantes estan afrontando un nuevo mundo. Debería ser un poco más entregado a sus estudiantes, no dejarlos a merced de sus residentes ni tampoco cargarles a ellos todo el trabajo como profesor, su apreciativa y su enseñanza debe estar orientada a fomentar el estudio no a subvalorizar el trabajo de sus estudiantes.  Tiene un libro de su autoria con diagramas de flujo que pueden ser una buena referencia en clínica. El sabe bastante pero podría mejorar siendo más pedagogo que especialista, después de todo es profesor, debe tomar de manera urgente y actualizar sus conocimientos en pedagogía.Pros: Explica a profundidad en sus revistas clínicas. Te hace reflexionar sobre tus dudas.Cons: Si no sabes algo saca comentarios sarcásticos y risas , no muy frecuentemente, aunque esto no es tan malo, pero si cuando deja que un residente lo coja de habito y humille a sus estudiantes","3"
