web-scraper-order,web-scraper-start-url,profesoresurl,profesoresurl-href,review,nota
"1576099579-227","https://losestudiantes.co/","Paola Andrea Cuervo PradoQuímica","https://losestudiantes.co/universidad-nacional/quimica/profesores/paola-andrea-cuervo-prado","Para dirigir trabajos de grado no es la persona más adecuada, no esta pendiente de las necesidades del estudiante. Piensa que es adecuado que uno se la pase encerrado en el laboratorio a toda hora independientemente de si uno tiene otras actividades, su forma de ver la investigación es quedese en el laboratorio así no tenga mucho que hacer allí o t...
Leer más...Pros: NingunoCons: No es recomendable para realizar trabajos de grado a mi y varios compañeros que actualmente cursamos posgrados no nos dio la supervisión y el apoyo requeridos","2.5"
"1576099694-262","https://losestudiantes.co/","Luis Enrique Cuca SuarezQuímica","https://losestudiantes.co/universidad-nacional/quimica/profesores/luis-enrique-cuca-suarez","Es un profesor muy bueno, enseña bien, y se sale con muy buenas bases del curso. Aunque todos los informes son a mano y con dibujos (coloreados) lo cual puede ser bastante escuelero, hay que entender que cada profesor tiene su método. Así que ignorando un poco esa panorámica, me quedo con que aprendí mucho y la dejé alta.","4.2"
"1576099350-110","https://losestudiantes.co/","Fabian Harvey Lopez VallejoQuímica","https://losestudiantes.co/universidad-nacional/quimica/profesores/fabian-harvey-lopez-vallejo","Es de los mejores profesores que he podido tener.
Señor para ser tan paciente y buena persona, es el profesor que de verdad busca que sus estudiantes aprendan sin tirar a matar. Con él se aprende muchísimo y nunca deja dudas, siempre esta dispuesto a ayudar.
Es muy puntual y organizado.Pros: Buena persona
No tira a matar
Puntual
De verdad se aprende con él","5"
"1576099407-139","https://losestudiantes.co/","Manuel Fredy Molina CaballeroQuímica","https://losestudiantes.co/universidad-nacional/quimica/profesores/manuel-fredy-molina-caballero","Pros: Es un profesor muy querido que le encanta hacer practicas de laboratorios con sus estudiantes y que a la vez sus parciales son muy fáciles. Cons: No se aprende bastante ya que en todo el semestre se ve más que todo titulación ácido-base. Es un poco escuelero,","1"
"1576099465-170","https://losestudiantes.co/","Barbara De Las Mercedes Moreno MurilloQuímica","https://losestudiantes.co/universidad-nacional/quimica/profesores/barbara-de-las-mercedes-moreno-murillo","Yo no la llamaría docente, pues ese rol no lo cumple en lo absoluto. Es déspota en su trato con los estudiantes. No enseña sino un 20% de los temas que se deberían ver en la asignatura, ero en los parciales califica como si l hubiera enseñado todo. No vale la pena ir a clase, pues los parciales se pasan sin necesidad de haber ido. Lo único bueno que tiene es que la calificación de los parciales y talleres son objetivos, pero, insisto, califica cosas que no se ha dictado en clase.
Se gasta el 80% del tiempo en regañar a todo el mundo y en hablar de cosas que no tienen relación con los temas de la clase.Pros: Es objetiva a la hora de calificar los parciales. Si uno estudia por su cuenta y sólo se dedica a presentarle las actividades que pide, se pasa la materia.Cons: Prácticamente toca estudiar todo autónomamente, porque transmite muy poco de lo que debería enseñar. Trata mal a todas las personas, y cualquier intervención en clase la considera una agresión, ante la cual reacciona de forma igualmente agresiva.
Además, para ella ""ya todo lo que se ve en la materia lo deberíamos saber"", de modo que, por eso, no enseña nada; porque ""ustedes ya deberían saber eso"".","1.5"
"1576099472-177","https://losestudiantes.co/","Josue Itsman Clavijo PenagosQuímica","https://losestudiantes.co/universidad-nacional/quimica/profesores/josue-itsman-clavijo-penagos","Es un excelente profesor, usa diapositivas para sus clases, siempre está dispuesto a responder las preguntas y sus respuestas son muy claras y puntuales, tiene un excelente manejo del tema de clase y se nota que le gusta lo que hace. 
Al principio del semestre deja un paquete de ejercicios que saca del Brown y los puntos del parcial son muy similares por lo que si se estudia, la materia es bastante fácil de pasar, además en sus parciales deja ""puntos opcionales"" que ayudan a subir la nota del parcial. Pros: Buen docente, se pasa fácil Cons: Es impuntual, hace chistes malos","4.5"
"1576099213-52","https://losestudiantes.co/","Oscar Javier Patiño LadinoQuímica","https://losestudiantes.co/universidad-nacional/quimica/profesores/oscar-javier-pati%C3%B1o-ladino","El profesor explica bien los temas, deja talleres que permiten praticar y los parciales son acorde con los temas vistos en clase. Es  amable y  paciente aunque un poco impuntual. Pros: Justo
Paciente
Claro 
Cons: impuntual","5"
"1576099472-175","https://losestudiantes.co/","Josue Itsman Clavijo PenagosQuímica","https://losestudiantes.co/universidad-nacional/quimica/profesores/josue-itsman-clavijo-penagos","El mejor profesor que he tenido, sabe mucho nunca vi que nadie lo corchara, es muy fácil son el uno la puede dejar re alta las clases las hace entretenidas no es nada aburrido y es muy buena persona","5"
"1576099393-136","https://losestudiantes.co/","Sonia Moreno GuaquetaQuímica","https://losestudiantes.co/universidad-nacional/quimica/profesores/sonia-moreno-guaqueta","Es muy buena explicando, a veces corre porque es demasiado tema en la materia pero habla de manera que uno entienda el fenómeno tratado en clase y habla sobre las cosas que se hacen en el laboratorio evidenciando qué fenómeno se está llevando a cabo. Los parciales pasados andan rotando por un drive y son fáciles para quien los estudia Pros: El seminario que pone, aterriza todo lo que estamos tratando y el hecho de que sea un ejemplo industrial lo hace más interesante","4"
"1576099486-183","https://losestudiantes.co/","Mauricio Maldonado VillamilQuímica","https://losestudiantes.co/universidad-nacional/quimica/profesores/mauricio-maldonado-villamil","Es muy organizado al explicar y si dice que hay que ponerle atención a algo es porque probablemente sale en el parcial. Se debe anotar todooo lo que ponga en el tablero. Da muchas ayudas durante el semestre y se debe llegar puntual a su clase.","4"
"1576099249-66","https://losestudiantes.co/","Eduard Ricardo Romero MalagonQuímica","https://losestudiantes.co/universidad-nacional/quimica/profesores/eduard-ricardo-romero-malagon","Como profesor es muy bueno. Explica muy bien los temas y siempre, siempre esta en su oficina en el horario de atención, dispuesto a responder tus dudas y aclarar lo confuso, aunque ya no veas materias con él. El problema es que no me parece que sea una buena persona; al principio del semestre es bien malo y coloca parciales muy difíciles para que las personas cancelen y no sé si lo hace porque le gusta rajar estudiantes, o porque le gusta calificar poquitos trabajos... pero sí es seguro que le quedan la mitad de los estudiantes al final y eso le encanta. Como ya dije, lo parciales son bien difíciles, más no imposibles, y sobre todo en la primera mitad del semestre. Deja tareas.Pros: Explica muy bienCons: Es malo como persona","3.5"
"1576099328-91","https://losestudiantes.co/","Martha Nancy Calderon OzunaQuímica","https://losestudiantes.co/universidad-nacional/quimica/profesores/martha-nancy-calderon-ozuna","Es súper buena, lo único que tienes que hacer son los talleres, e investigar un poquito más a fondo los temas, ella a veces pone tareas, como investigar algo, o resolver algún ejercicio, son super fáciles hazlas, si haces esto pasas con 5, ella deja sacar el cuaderno en los parciales si tienes los talleres completos (los talleres generalmente son solo investigación), y para asegurar más nota resuelve los ejercicios que ella pone en las diapositivas, son fáciles, es una de las pocas materias que puedes sacar con 5.Pros: -Los talleres que deja son clave en los parciales.
-Los parciales son super fáciles (si haces los talleres).
-La profesora explica super bien (siempre y cuando resuelvas los talleres de cada módulo antes de iniciar la clase del módulo).Cons: No tengo ninguno, solo es que tienes que dedicar un poquito a la materia, pero realmente no es mucho.","5"
"1576099307-79","https://losestudiantes.co/","Gilma Granados OliverosQuímica","https://losestudiantes.co/universidad-nacional/quimica/profesores/gilma-granados-oliveros","Me gusta su clase. Es exigente pero se aprende.","5"
"1576099192-28","https://losestudiantes.co/","Jose Leopoldo Rojas AraqueQuímica","https://losestudiantes.co/universidad-nacional/quimica/profesores/jose-leopoldo-rojas-araque","Pros: Explica muy bien y tiene gran conocimiento en la materia 
Los parciales suelen salir de los talleres o son ejercicios muy similares
Deja trabajos que ayudan a subir la materia
Califica suave los seminariosCons: La clase con el no es amena, mucha gente tiende a dormirse
Habla muy pasito por lo cual hacerse adelante es necesario para poder entender","4"
"1576099192-29","https://losestudiantes.co/","Jose Leopoldo Rojas AraqueQuímica","https://losestudiantes.co/universidad-nacional/quimica/profesores/jose-leopoldo-rojas-araque","Excelente docente, sabe muchísimo de fisicoquimica. Tiene una alta capacidad para explicar temas complejos como lo son los de fisicoquimica de una manera atendible. Deja talleres para preparar los parciales los cuales son muy buenos. Sus clases, para mi en lo personal me parecen muy entretenidas. Uno de los mejores profes de la Universidad que he tenido.","5"
"1576099213-47","https://losestudiantes.co/","Oscar Javier Patiño LadinoQuímica","https://losestudiantes.co/universidad-nacional/quimica/profesores/oscar-javier-pati%C3%B1o-ladino","Buen profesor, explica muy bien los temas, Los talleres son largos pero uno aprende bastante. Si se hacen correctamente los talleres, los parciales se dejan sobre 4.Pros: -Buenas explicaciones
-Se deja hablar (No es grosero)","4.5"
"1576099321-89","https://losestudiantes.co/","Pedro Jose Hernandez CastilloQuímica","https://losestudiantes.co/universidad-nacional/quimica/profesores/pedro-jose-hernandez-castillo","Profesor muy vago, siempre llega tarde a clase, extiende los parciales, no explica bien, habla mucho de la vida y la medicina. Al final inventa las notas.","2.4"
"1576099557-209","https://losestudiantes.co/","Nelson Jair Castellanos MarquezQuímica","https://losestudiantes.co/universidad-nacional/quimica/profesores/nelson-jair-castellanos-marquez","Si eres buen estudiante te tiene en cuenta, parciales no muy dificiles
Recomendado para Principios.
Exigente.Pros: Exigente","5"
"1576099307-78","https://losestudiantes.co/","Gilma Granados OliverosQuímica","https://losestudiantes.co/universidad-nacional/quimica/profesores/gilma-granados-oliveros","Terrible profesora; no se aprende nada con ella. Se enrreda con los temas y en los parciales inventa cosas que no son. 
NO es dificil la materia con ella, lo dificil es aguantarsela.","1.9"
"1576099450-162","https://losestudiantes.co/","Luis Carlos Moreno AldanaQuímica","https://losestudiantes.co/universidad-nacional/quimica/profesores/luis-carlos-moreno-aldana","Buen docente, se aprende bastante aunque aveces se enreda un poco, esta disponible casi siempre y sus parciales son relativamente fáciles. Claro esta que la materia en si es algo complicada, pero el la hace amena.","4"
"1576099687-258","https://losestudiantes.co/","Rafael Alberto Molina GallegoQuímica","https://losestudiantes.co/universidad-nacional/quimica/profesores/rafael-alberto-molina-gallego","Excelente profesor explica claro aunque a veces va muy rápido y las diapositivas que utiliza son un poco saturadas.Pros: se esmera en enseñar y por que el estudiante aprendaCons: a veces va muy rapido","5"
"1576099550-192","https://losestudiantes.co/","Gloria Ivonne Cubíllos GonzálezQuímica","https://losestudiantes.co/universidad-nacional/quimica/profesores/gloria-ivonne-cub%C3%ADllos-gonz%C3%A1lez","La profe es muy buena, realiza ejercicios muy difíciles para entrenarnos para el parcial, tiene culturas generales o ""chismes de química"", es graciosa y sabe mucho Pros: Es muy amable y quiere que sus estudiantes aprendan y pasen la metería Cons: Es muy puntual","4.5"
"1576099557-212","https://losestudiantes.co/","Nelson Jair Castellanos MarquezQuímica","https://losestudiantes.co/universidad-nacional/quimica/profesores/nelson-jair-castellanos-marquez","El profesor es muy cordial y a pesar de su aspecto serio e intimidante, es muy presto para resolver dudas e inquietudes, sus parciales son trabajables, los quices son sencillos, en los seminarios puede llegar a ser un poco corchador pero lo importante es ser coherente con lo que se está exponiendo y no decir cosas incorrectas, en los informes le pone más atención a una presentación ordenada y a un análisis adecuado de las prácticas realizadas, no es necesario presentarle un tratado de infinitas páginas para obtener notas altas. Es un buen docente, en especial para carreras en las que no se requiere un conocimiento muy profundo de química posteriormente.","4"
"1576099168-18","https://losestudiantes.co/","Carlos Enrique Daza VelasquezQuímica","https://losestudiantes.co/universidad-nacional/quimica/profesores/carlos-enrique-daza-velasquez","El laboratorio es muy entretenido, los quices que hace no son del otro mundo, es intenso con la puntualidad.Pros: Todo bienCons: Nada","5"
"1576099168-25","https://losestudiantes.co/","Carlos Enrique Daza VelasquezQuímica","https://losestudiantes.co/universidad-nacional/quimica/profesores/carlos-enrique-daza-velasquez","Explica muy bien. Los parciales están bien. Es bueno realizar los talleres, son bastantes, pero sencillos generalmente. 
Usa diapositivas muy completas y maneja un cuadernillo donde están dichas diapositivas, es útil en la medida que se agiliza clase pues solo es necesaario hacer una que otra anotación.  Es exigente con la puntualidad, más de 5 min de retraso hace que se quede por fuera de la clase. 
Pros: Puntual
Explica bien y atiende dudas amablemente
Es justo con las calificaciones
Cons: A veces se pone de mal genio y la clase puede llegar a ser tensa, pero realmente no es tan grave, es más una forma de molestar a los impuntuales y a los que no son cumplidos con los talleres.","4"
"1576099161-14","https://losestudiantes.co/","Yazmin Yaneth Agamez PertuzQuímica","https://losestudiantes.co/universidad-nacional/quimica/profesores/yazmin-yaneth-agamez-pertuz","Es una excelente docente, explica muy bienCons: Deja muchos trabajos y talleres","4.4"
"1576099350-109","https://losestudiantes.co/","Fabian Harvey Lopez VallejoQuímica","https://losestudiantes.co/universidad-nacional/quimica/profesores/fabian-harvey-lopez-vallejo","Excelente profesor","5"
"1576099443-153","https://losestudiantes.co/","Eliana Castillo SernaQuímica","https://losestudiantes.co/universidad-nacional/quimica/profesores/eliana-castillo-serna","Esta profesora se ha prestado con el profesor fabian parada para hacer expulsar alumnos que no les agrada ella dentro de su calificación de exigente en realidad es una persona falta de ética tengan cuidado con ella","1.5"
"1576099168-16","https://losestudiantes.co/","Carlos Enrique Daza VelasquezQuímica","https://losestudiantes.co/universidad-nacional/quimica/profesores/carlos-enrique-daza-velasquez","Depende de su humor es como trata a los estudiantes. Sus parciales son tratables y si haces todo puedes dejar la nota de trabajos en 5.0. No hay que confiarse porque en mi caso el último parcial lo mandó a matar.","3"
"1576099350-107","https://losestudiantes.co/","Fabian Harvey Lopez VallejoQuímica","https://losestudiantes.co/universidad-nacional/quimica/profesores/fabian-harvey-lopez-vallejo","Da las pautas necesarias en el laboratorio, y esta dispuesto a resolver las dudas en la practica, hace quices todas las practicas.","5"
"1576099235-61","https://losestudiantes.co/","Fabian Orozco LopezQuímica","https://losestudiantes.co/universidad-nacional/quimica/profesores/fabian-orozco-lopez","Buen docente, con gran experiencia en el campo de la química de heterociclos. Se aprende mucho en esta materia. 
Pros: En mi caso que soy de farmacia me gusto que al final de cada tema, explicaba ejemplos de síntesis de medicamentos relacionados con el tema visto, lo cual enriquece la clase.Cons: Personalmente no me gusta el hecho de que en las reacciones, dadas no explique el mecanismo de como ocurren, ya que pues me gusta entender mecanisticamente como ocurren las reacciones químicas.
Si usted es una persona la cual la química orgánica  no es de su total agrado y solo le importa aprenderse reactivos y saber que productos dan y no le gustan los mecanismos, El es una buena opción.","3.2"
"1576099213-48","https://losestudiantes.co/","Oscar Javier Patiño LadinoQuímica","https://losestudiantes.co/universidad-nacional/quimica/profesores/oscar-javier-pati%C3%B1o-ladino","El profe es una madre. Quien lo tenga de profesor tiene la certeza de aprender y pasar. Deja trabajos, de ahí salen los parciales","5"
"1576099343-96","https://losestudiantes.co/","Patricia Martinez MuñozQuímica","https://losestudiantes.co/universidad-nacional/quimica/profesores/patricia-martinez-mu%C3%B1oz","Es una excelente profesora, la mejor profesora de química que he tenido en mi vida. Sabe demasiado, y lo mejor es que sabe transmitir su conocimiento, le encanta lo que hace y siempre se asegura de hacer entender por completo cada tema, por pequeño que sea.Pros: Es muy organizada y clara
Cons: Mete miedo","5"
"1576099407-141","https://losestudiantes.co/","Manuel Fredy Molina CaballeroQuímica","https://losestudiantes.co/universidad-nacional/quimica/profesores/manuel-fredy-molina-caballero","Todo lo que ya leyeron, es totalmente cierto. Hablo de TODO. De mi parte, no hace falta decir nada más, ya todo lo mencionaron.","4.5"
"1576099364-128","https://losestudiantes.co/","Orlando Hernandez FandinoQuímica","https://losestudiantes.co/universidad-nacional/quimica/profesores/orlando-hernandez-fandino","No es un mal profesor pero tampoco es muy bueno, es un profesor vieja escuela que trata de hacer entender los temas basándose en su experiencia y con ejemplos de la vida cotidiana pero al final de cuentas se ciñe a explicar los temas tal y como están en los libros. Sus parciales son en un 90% solo cálculos matemáticos, pasables si uno sabe exactamente que tiene que hacer, es mas memoria que comprensión.Pros: Cuando explica es muy concretoCons: Los parciales son de mucha memoria, no tanto de comprension.","3"
"1576099206-46","https://losestudiantes.co/","Jorge Isaac Ali TorresQuímica","https://losestudiantes.co/universidad-nacional/quimica/profesores/jorge-isaac-ali-torres","Uno de los mejores profesores que he tenido en la carrera.
Explica muy bien, es super organizado con la clase y además crea un ambiente agradable.
Sabe muchisimo de quimica, por lo que contagia ese amor por la materia, hace muchos ejercicios en clase, por lo que uno puede desarrollar el taller facilmente, y el parcial es muy parecido al taller (taller que no es largo), entonces con juicio se puede dejar muy alta la materia.Pros: Ordenado y rápido con notas
Explica muy bien
Hace muchos ejercicios en clase
Sus parciales son fáciles si hizo el taller","5"
"1576099472-171","https://losestudiantes.co/","Josue Itsman Clavijo PenagosQuímica","https://losestudiantes.co/universidad-nacional/quimica/profesores/josue-itsman-clavijo-penagos","En un gran docente, se esmera para que el estudiante aprenda. Deja algunos trabajos en grupo sobre consultas, hace experimentos en clases. Es muy estricto con el uso del celular.
Pros: Parciales trabajables 
Hace amena la clase","4.4"
"1576099292-75","https://losestudiantes.co/","Ivonne Jeannette Nieto RamirezQuímica","https://losestudiantes.co/universidad-nacional/quimica/profesores/ivonne-jeannette-nieto-ramirez","Es bastante exigente y no es muy paciente resolviendo dudas ya que espera que usted lo sepa todo a la hora de entrar en el laboratorio. Los informes son extremandamente largos (15 a 20 páginas en word) que toca pasar a mano y califica duro en los informes. Sin embargo, es muy conocedora del tema y está dispuesta a decirle que tuvo mal en cada uno de sus informes. Pros: - Puntual con las notas 
- Conocedora del tema 
Cons: - Muy exigente en parciales, informes, y quizzes
- Poco paciente a la hora de resolver dudas","3.5"
"1576099300-76","https://losestudiantes.co/","Pedro Felipe De Brito BrandaoQuímica","https://losestudiantes.co/universidad-nacional/quimica/profesores/pedro-felipe-de-brito-brandao","Es un excelente docente y maravillosa persona,muy interesado en el aprendizaje de los estudiantes. Se le nota las ganas de enseñar y lo hace bien.
Si cometes un error te corrige,pero sin ser grosero y te pregunta si te sentiste mal cuando te corrigió.","5"
"1576099328-95","https://losestudiantes.co/","Martha Nancy Calderon OzunaQuímica","https://losestudiantes.co/universidad-nacional/quimica/profesores/martha-nancy-calderon-ozuna","Es muy flexible en cuanto a las notas, aunque es demasiado fastidiosa. Molesta por muchas pendejadas. No explica bien y da la impresión que no tiene dominio del tema. El monitor era lo mejor de la clase, él parecía el profesor. Nunca se sabía que tocaba hacer. Pros: Es fácil.
Se deja alta.Cons: Fastidiosa.
Gritona.","3.5"
"1576099168-23","https://losestudiantes.co/","Carlos Enrique Daza VelasquezQuímica","https://losestudiantes.co/universidad-nacional/quimica/profesores/carlos-enrique-daza-velasquez","explica muy bien, sus parciales no son del todo faciles pero tampoco son muy dificiles, hace la clase amena, aunque es muy estricto con el uso del celular y el prestar atención en general","3.8"
"1576099557-207","https://losestudiantes.co/","Nelson Jair Castellanos MarquezQuímica","https://losestudiantes.co/universidad-nacional/quimica/profesores/nelson-jair-castellanos-marquez","Es exigente pero explica muy bien los temas, se extiende muchoPros: Deja ejercicios para subir décimas en el parcial, explica relativamente bien y se le entiende, buena persona Cons: Hay que trabajarle mucho pero a pesar de eso va a aprender, se puede tornar muy difícil la clase, tiene que estudiar bastante por su cuenta si la quiere pasar","3"
"1576099140-11","https://losestudiantes.co/","Marco Fidel Suarez HerreraQuímica","https://losestudiantes.co/universidad-nacional/quimica/profesores/marco-fidel-suarez-herrera","Cuando dicta química de sólidos se esmera mucho en la comprensión de los fenómenos de corrosión y de propiedades eléctricas y magnéticas de los materiales. Aunque como esta asignatura es optativa, se requiere bastante trabajo independiente, se puede obtener la máxima calificación si se realiza el esfuerzo adecuadoPros: Excelentes explicaciones
Puntual","5"
"1576099450-157","https://losestudiantes.co/","Luis Carlos Moreno AldanaQuímica","https://losestudiantes.co/universidad-nacional/quimica/profesores/luis-carlos-moreno-aldana","Es un excelente profesor, de los mejores que he tenido en mi estadía en la un. Muy buen pedagogo, muy dedicado a sus estudiantes y siempre muy dispuesto a resolver dudas incluso de las cosas más pequeñas. Aparte, se puede dejar muy alta. Recomendadísimo.","5"
"1576099364-118","https://losestudiantes.co/","Orlando Hernandez FandinoQuímica","https://losestudiantes.co/universidad-nacional/quimica/profesores/orlando-hernandez-fandino","Las clases son interesantes aunque es muy fácil perder el hilo de la clase, explica muy rápido y con pocos ejemplos lo cual es poco favorable. En los parciales califica demasiado duro y es muy dificil sacar una nota mayor a 4.5, además deja de a 4-5 lecturas las cuales hay que memorizar por completo. Deja talleres los cuales no califica pero pues algunas preguntas de los parciales salen de ahí o de los ejemplos en clase (muy pocos). Sin embargo siempre está dispuesto a aclarar dudas.Pros: Se aprende mucho.
Relaciona los temas con la vida laboral y cotidiana.
Resuelve dudas si las hay.Cons: Parciales difíciles.
Exige memorizar lecturas.
Casi no da ayudas como talleres o trabajos.","3.5"
"1576099364-119","https://losestudiantes.co/","Orlando Hernandez FandinoQuímica","https://losestudiantes.co/universidad-nacional/quimica/profesores/orlando-hernandez-fandino","Bueno dominio del tema. Explica muchas cosas y soluciona las dudas que uno tenga. No obstante los parciales son extensos y califica duro.
En muchos casos toca memorizar datos  (de lecturas que deja y de la clase )que a la larga no son tan importantes para la carrera.Pros: Buen dominio de temas y atento a la solución de dudas.Cons: Parciales extensos y califica duro.","3"
